{
  "$schema": "https://json-schema.org/draft/2020-12/schema",
  "$id": "https://radiquant.local/contracts/projections/radi144-materialized-projection-migration-enablement-decision.schema.v1.json",
  "title": "radiquant-v5 Radi144 Materialized Projection Migration Enablement Decision Gate v1",
  "type": "object",
  "additionalProperties": false,
  "required": [
    "schema_id",
    "decision",
    "status",
    "migration_enablement_decision_recorded",
    "alembic_migration_enabled",
    "projection_storage_tables_enabled",
    "orm_model_enabled",
    "projection_write_service_enabled",
    "worker_projection_materialization_enabled",
    "required_future_gate",
    "enablement_preconditions",
    "required_invariants"
  ],
  "properties": {
    "schema_id": { "type": "string", "const": "radi144_materialized_projection_migration_enablement_decision_v1" },
    "decision": { "type": "string", "const": "defer_migration_enablement_until_explicit_implementation_gate" },
    "status": { "type": "string", "const": "migration_enablement_decision_recorded_migration_disabled" },
    "migration_enablement_decision_recorded": { "type": "boolean", "const": true },
    "alembic_migration_enabled": { "type": "boolean", "const": false },
    "projection_storage_tables_enabled": { "type": "boolean", "const": false },
    "orm_model_enabled": { "type": "boolean", "const": false },
    "projection_write_service_enabled": { "type": "boolean", "const": false },
    "worker_projection_materialization_enabled": { "type": "boolean", "const": false },
    "required_future_gate": { "type": "string", "const": "radi144_materialized_projection_migration_implementation_gate_decision" },
    "enablement_preconditions": { "type": "array", "items": { "type": "string" }, "minItems": 6, "uniqueItems": true },
    "required_invariants": { "type": "array", "items": { "type": "string" }, "minItems": 7, "uniqueItems": true }
  }
}
