{
  "schema_id": "radi144_materialized_projection_migration_enablement_decision_v1",
  "decision": "defer_migration_enablement_until_explicit_implementation_gate",
  "status": "migration_enablement_decision_recorded_migration_disabled",
  "migration_enablement_decision_recorded": true,
  "alembic_migration_enabled": false,
  "projection_storage_tables_enabled": false,
  "orm_model_enabled": false,
  "projection_write_service_enabled": false,
  "worker_projection_materialization_enabled": false,
  "required_future_gate": "radi144_materialized_projection_migration_implementation_gate_decision",
  "enablement_preconditions": [
    "orm_implementation_decision_recorded",
    "migration_revision_plan_reviewed",
    "foreign_key_ordering_reviewed",
    "rollback_policy_defined",
    "backfill_policy_defined",
    "data_retention_policy_reviewed",
    "write_service_still_blocked"
  ],
  "required_invariants": [
    "decision_only_no_alembic_revision",
    "decision_only_no_database_table",
    "decision_only_no_orm_model",
    "decision_only_no_write_service",
    "no_worker_projection_materialization",
    "api_read_projection_remains_on_demand",
    "stored_result_payload_remains_source_of_truth",
    "raw_debug_columns_forbidden"
  ]
}
